title,description
XYZ ERP,"XYZ ERP, işletmelerin operasyonlarını daha verimli yönetmelerine yardımcı olan entegre bir yazılım çözümüdür. Bu sistem, finans, muhasebe, insan kaynakları, envanter yönetimi, üretim planlama, satış ve müşteri ilişkileri gibi temel iş süreçlerini tek bir platformda birleştirir. XYZ ERP, kullanıcılara gerçek zamanlı veri analitiği ve raporlama imkânı sunarak daha bilinçli kararlar alınmasına olanak tanır. Temel özellikleri şunlardır: Modüler Yapı: İşletmelerin ihtiyaçlarına göre özelleştirilebilen farklı modüller sunar. Kullanıcı Dostu Arayüz: Kolay öğrenilebilir ve hızlı kullanım için tasarlanmıştır. Bulut veya Yerel Sunucu: İsteğe bağlı olarak bulut tabanlı veya şirket içi kurulum seçenekleri. Entegrasyon Yeteneği: Diğer yazılımlar ve sistemlerle kolayca entegre olabilir."
Satış Siparişi Oluşturma,"XYZ ERP'de bir satış siparişi, 'Siparişlerim' menüsü altındaki 'Satış Siparişlerim' sayfasında oluşturulmaktadır. 'Yeni Sipariş Ekle' butonuna basarak yeni bir satış siparişi ekleyebilirsiniz!"
Stok Seviyelerini Kontrol Etme,XYZ ERP'de stok seviyelerini kontrol etmek için 'Stok>Stok Seviyesi>İşlemler' sekmesinde yer alan 'Stok Seviye' modülünü kullanabilirsiniz. Bu modülde stok seviyelerini kontrol edebilir ve gerektiğinde stok güncellemesi yapabilirsiniz."
Kullanıcı Yetkilendirmesi/Kullanıcıya Yetki Verme,XYZ ERP programında kullanıcı yetkilendirmesi için 'Hesaplar ve Yetkilendirme' menüsüne gidiniz. Daha sonra 'Kullanıcı Listesini Gör' butonu kullanılarak kullanıcı listesini açınız. Bu listede yetkilendirme yapacağınız kullanıcıyı arayarak seçebilirsiniz. Daha sonra sağ kısımdaki yetkilendirme alanından yetkisini verip onaylamanız gerekmektedir. Yetkilendirme işlemini dikkatli yapmanız önerilmektedir. Aksi takdirde tüm sistem verilerinin gizliliği tehlikeye girebilir."
Finansal Rapor Hazırlama,"XYZ ERP yazılımdan finansal rapor hazırlamak için, 'Satış İstatistikleri' menüsünden 'Mali Kayıtlar' kategorisinde bulunan 'Finansal Rapor Hazırla' sihirbazını kullanarak, ilgili dönemi ve ürünü seçerek ürüne özel raporunuzu hazırlayabilirsiniz. Hazırladığınız raporları 'Raporlarım' kategorisinde görüntüleyebilir. Herhangi bir formatta indirebilir ve anında yazdırabilirsiniz."
Müşteri Bilgilerini Güncelleme,"XYZ ERP yazılımı için müşteri bilgilerini güncellemek oldukça kolaydır. 'Cari Müşteri Listesi' menüsüne giderek, güncellemek istediğiniz müşteriyi seçiniz. Müşteri bilgilerini güncelleyebilir ve kaydedebilirsiniz. Müşteriye ait veriler KVKK kapsamında korunmaktadır. Lütfen bu bilgileri değiştirirken dikkatli davranın."
Tedarik Sipariş Takibi,"XYZ ERP'de Tedarik siparişi, 'Sipariş Hareketleri' menüsünden kolayca takip edilebilir. İlgili siparişin 'Sipariş Durumu' alanından siparişin durumunu takip edebilirsiniz."
Maaş Bordrosu Oluşturma,"XYZ ERP programında maaş bordrosu oluşturmak için PDKS modülüne giderek, 'Maaş Bordrosu Oluştur' butonuna tıklayarak, çalışanın maaş bilgilerini girerek maaş bordrosunu kolayca oluşturabilirsiniz."
Üretim Planlaması,"XYZ ERP'de üretim planlaması için ilk olarak üretimin girdi ve çıktı maliyetleri analiz edilerek, ilgili ürünün rakip piyasa analizleri yapılır. Daha sonra üretim maliyetleri hesaplanır ve rakip piyasa analizi ile şirketin maliyet analizleri karşılaştırılır. Son aşamada üretim planlamasında kullanılacak olan ürünler, üst rakip piyasa değerinden %15 fiyat düşürülerek taban fiyatı belirlenir."
Entegrasyon İle Dış Sistemlere Veri Aktarma,"XYZ ERP'de entegrasyon ile dış sistemlere veri aktarma şu şekilde yapılır: XYZ Connector yazılımıyla, ilgili programdan XYZ Yazılım'a istenilen kayıtların aktarımı sağlanır. Bu program ile ilgi detaylı bilgi almak isterseniz XYZ Yazılım'dan Zekeriya Çakır Bey ile iletişime geçmeniz tavsiye edilir."
Entegrasyon,"Entegrasyon, farklı sistemlerin, yazılımların veya bileşenlerin bir arada çalışabilmesini sağlama sürecidir. Entegrasyon, farklı işlevselliklere veya teknolojilere sahip sistemlerin bir araya getirilerek birbirleriyle veri alışverişi yapabilmesi, birlikte sorunsuz çalışabilmesi ve daha geniş bir çözüm sunabilmesi anlamına gelir."
Entegrasyon yapmak,"API'ler aracılıyla ilgili sisteminizin tüm gereksinimlerini karşılayacak düzenlemelerle ve genellikle bir kimlik doğrulama anahtarı (API Key) kullanarak gerekli modüller ve servisleri sisteme dahil ederek entegrasyon işlemlerini gerçekleştirebilirsiniz."
Entegrasyon çalışmıyor,"Entegrasyonunuz çalışmıyorsa, sorunu çözmek için sistematik bir şekilde şu adımları izleyebilirsiniz: 1. Hata loglarını inceleyin. Hata Logları içerisinde yer alan hata mesajlarına göre çözüme yaklaşabilirsiniz. 2. API bağlantısını ve servislerinizi kontrol edin. 3. Kodunuzu tekrar gözden geçirin ve kod içerisinde try catch blogları kullarak harayı tespit etmeye çalışın. 4. Yetkilendirmelerinizi kontrol edin. 5. Ağ bağlantısı ve erişim düzeyinizi kontrol edin. 6. Test ortamını kullnarak sorunları izole edin."
Satış modülünün entegrasyonu,"ERP Satış Modülü Entegrasyon Adımları Giriş ve Yetkilendirme ERP sistemine giriş yap API anahtarını veya kimlik doğrulama bilgilerini al. Müşteri Yönetimi "Müşteri" sayfasına git. API üzerinden müşteri ekle/güncelle entegrasyonu yap. Ürün Yönetimi "Ürünler" sayfasına git. Ürün stok durumu ve fiyatlarını ERP'den çek. Sipariş Yönetimi "Siparişler" sayfasına git. Sipariş oluşturma/güncelleme işlemlerini ERP'ye bağla. Fatura Yönetimi "Faturalar" sayfasına git. ERP'ye siparişten fatura oluşturma entegrasyonunu ekle. Stok Güncelleme "Stoklar" sayfasına git. ERP'den stok bilgilerini düzenli çekmek için API çağrısı yaz. Hata Yönetimi ve Loglama "Loglar" veya "Bildirimler" sayfasına git. Hata mesajlarını ve entegrasyon durumlarını kontrol et. Test ve Canlıya Alma Test ortamında tüm modülleri doğrula. Üretim ortamına geçiş yap. Bu adımları takip ederek modüler şekilde ilerleyebilirsin."
E-Faturam görünmüyor/E-Faturam yok/E-Faturamı bulamıyorum,"Eğer E-Faturanızı XYZ ERP programında görüntüleyemiyorsanız, GIB portal üzerinden e-devlet şifrenizi girerek 'Gelen Faturalarım' kategorisinden kolayca görüntüleyebilirsiniz."
Envanter Yönetimi(Optimizasyon),"XYZ ERP'de envanter yönetimi yan menüdeki 'Depo Stok Yönetimi' modülü üzerinden 'Envanter Düzenle' butonuna tıklayarak, stok seviyelerini kontrol edebilir ve otomatik sipariş verme özelliğini kullanarak envanter yönetimini optimize edebilirsiniz."
Tedarikçi Performansını Değerlendirme,"XYZ ERP'de tedarikçi performansını değerlendirmek için; tedarik siparişi tamamlandığında 'Tedarikçi Performansı' modülü üzerinden tedarikçi performansını değerlendirebilir ve ilgili raporları görüntüleyebilirsiniz."
İade İşlemi/İade İşlemi Menüsü/İade Faturası,"XYZ ERP'de iade işlemi, 'Satış İşlemleri' menüsünden 'İade İşlemleri' sekmesi üzerinden kolayca gerçekleştirilebilir. İade edilecek ürün ve müşteri bilgilerini girerek işlemi tamamlayabilirsiniz. Ayrıca iade işlemleri için 'İade Faturası' oluşturabilirsiniz. Bu işlemi 'Fatura İşlemleri' menüsünden gerçekleştirebilirsiniz."
Müşteri Verilerinin(Bilgilerinin) Güvenliği,"XYZ ERP'de müşteri verilerini güvenli bir şekilde saklamak için, 'Müşteri Bilgileri' modülü üzerinden müşteri verilerini şifreleyebilir ve erişim izinlerini kontrol edebilirsiniz. Ayrıca, veri tabanı yedekleme ve güvenlik önlemleri alarak müşteri verilerini koruyabilirsiniz. Çeşitli şifreleme yöntemleri kullanarak verilerinizi koruyabilirsiniz."
Ürün Fiyatlarını Güncelleme/Ürün Güncelleme,XYZ ERP'de ürün fiyatlarını güncellemek için 'Stok Yönetimi' modülü üzerinden 'Ürünler' sekmesine gidin. Düzenlemek istediğiniz ürünü seçerek fiyat bilgilerini güncelleyebilirsiniz. Değişiklikleri kaydederek fiyat güncellemesini tamamlayabilirsiniz."
Yeni Ürün Ekleme/Ürün Ekleme,"XYZ ERP'de yan menüdeki 'Stok Yönetimi' modülünde bulunan 'Ürün Ekle' seçeneğini seçin. Ürün adı, kodu, fiyatı ve stok seviyelerini girerek kaydedin. Yeni ürününüzü başarıyla eklemiş olacaksınız."
